{
  "header": {
    "contractId": "018f22e2-7c15-7b12-8d86-2de956a9d207",
    "contractType": "zhiju.contract.release_readiness",
    "contractVersion": "1.0",
    "schemaRef": {
      "kind": "OBJECT",
      "objectType": "zhiju.contract.schema",
      "objectId": "018f22e2-7c15-7b12-8d86-2de956a9d207",
      "scope": {
        "enterpriseId": "018f22e2-7c15-7b2e-8d86-2de956a9d201"
      }
    },
    "scopeRef": {
      "enterpriseId": "018f22e2-7c15-7b2e-8d86-2de956a9d201"
    },
    "issuedAt": "2026-08-17T00:00:00Z",
    "issuedBy": {
      "kind": "OBJECT",
      "objectType": "zhiju.contract.issued_by",
      "objectId": "018f22e2-7c15-7b12-8d86-2de956a9d207",
      "scope": {
        "enterpriseId": "018f22e2-7c15-7b2e-8d86-2de956a9d201"
      }
    },
    "correlationId": "018f22e2-7c15-7b2e-8d86-2de956a9d205",
    "dataClassification": "INTERNAL",
    "canonicalizationVersion": "1",
    "payloadHash": {
      "algorithm": "SHA-256",
      "digest": "0000000000000000000000000000000000000000000000000000000000000000",
      "canonicalizationVersion": "1"
    }
  },
  "snapshotId": "018f22e2-7c15-7b92-8d86-2de956a9d20f",
  "releaseRef": {
    "kind": "OBJECT",
    "objectType": "zhiju.release.release",
    "objectId": "018f22e2-7c15-7ba2-8d86-2de956a9d210",
    "scope": {
      "enterpriseId": "018f22e2-7c15-7b2e-8d86-2de956a9d201",
      "projectId": "018f22e2-7c15-7b2e-8d86-2de956a9d202"
    }
  },
  "artifactRef": {
    "kind": "OBJECT",
    "objectType": "zhiju.artifact.artifact",
    "objectId": "018f22e2-7c15-7b32-8d86-2de956a9d209",
    "scope": {
      "enterpriseId": "018f22e2-7c15-7b2e-8d86-2de956a9d201",
      "projectId": "018f22e2-7c15-7b2e-8d86-2de956a9d202"
    }
  },
  "revisionRef": {
    "kind": "CONTENT_ADDRESSED",
    "objectType": "zhiju.artifact.artifact_revision",
    "objectId": "018f22e2-7c15-7b42-8d86-2de956a9d20a",
    "scope": {
      "enterpriseId": "018f22e2-7c15-7b2e-8d86-2de956a9d201",
      "projectId": "018f22e2-7c15-7b2e-8d86-2de956a9d202"
    },
    "contentHash": {
      "algorithm": "SHA-256",
      "digest": "0000000000000000000000000000000000000000000000000000000000000000",
      "canonicalizationVersion": "1"
    }
  },
  "approvalBundleSnapshotRef": {
    "kind": "SNAPSHOT",
    "objectType": "zhiju.quality.approval_bundle_snapshot",
    "objectId": "018f22e2-7c15-7b32-8d86-2de956a9d209",
    "snapshotId": "018f22e2-7c15-7b82-8d86-2de956a9d20e",
    "scope": {
      "enterpriseId": "018f22e2-7c15-7b2e-8d86-2de956a9d201",
      "projectId": "018f22e2-7c15-7b2e-8d86-2de956a9d202"
    },
    "contentHash": {
      "algorithm": "SHA-256",
      "digest": "0000000000000000000000000000000000000000000000000000000000000000",
      "canonicalizationVersion": "1"
    }
  },
  "releasePackageRef": {
    "releaseRef": {
      "kind": "OBJECT",
      "objectType": "zhiju.release.release",
      "objectId": "018f22e2-7c15-7ba2-8d86-2de956a9d210",
      "scope": {
        "enterpriseId": "018f22e2-7c15-7b2e-8d86-2de956a9d201",
        "projectId": "018f22e2-7c15-7b2e-8d86-2de956a9d202"
      }
    },
    "packageSnapshotRef": {
      "kind": "SNAPSHOT",
      "objectType": "zhiju.release.release_package",
      "objectId": "018f22e2-7c15-7bb2-8d86-2de956a9d211",
      "snapshotId": "018f22e2-7c15-7b22-8d86-2de956a9d208",
      "scope": {
        "enterpriseId": "018f22e2-7c15-7b2e-8d86-2de956a9d201",
        "projectId": "018f22e2-7c15-7b2e-8d86-2de956a9d202"
      },
      "contentHash": {
        "algorithm": "SHA-256",
        "digest": "0000000000000000000000000000000000000000000000000000000000000000",
        "canonicalizationVersion": "1"
      }
    },
    "packageHash": {
      "algorithm": "SHA-256",
      "digest": "0000000000000000000000000000000000000000000000000000000000000000",
      "canonicalizationVersion": "1"
    }
  },
  "purpose": "CUSTOMER_DELIVERY",
  "recipientScopeSnapshotRef": {
    "kind": "SNAPSHOT",
    "objectType": "zhiju.release.recipient_scope_snapshot",
    "objectId": "018f22e2-7c15-7bc2-8d86-2de956a9d212",
    "snapshotId": "018f22e2-7c15-7b22-8d86-2de956a9d208",
    "scope": {
      "enterpriseId": "018f22e2-7c15-7b2e-8d86-2de956a9d201",
      "projectId": "018f22e2-7c15-7b2e-8d86-2de956a9d202"
    },
    "contentHash": {
      "algorithm": "SHA-256",
      "digest": "0000000000000000000000000000000000000000000000000000000000000000",
      "canonicalizationVersion": "1"
    }
  },
  "destinationRefs": [
    {
      "kind": "CONTENT_ADDRESSED",
      "objectType": "zhiju.integration.destination",
      "objectId": "018f22e2-7c15-7bd2-8d86-2de956a9d213",
      "scope": {
        "enterpriseId": "018f22e2-7c15-7b2e-8d86-2de956a9d201",
        "projectId": "018f22e2-7c15-7b2e-8d86-2de956a9d202"
      },
      "contentHash": {
        "algorithm": "SHA-256",
        "digest": "0000000000000000000000000000000000000000000000000000000000000000",
        "canonicalizationVersion": "1"
      }
    }
  ],
  "releaseRequirements": [
    {
      "requirementId": "018f22e2-7c15-7d72-8d86-2de956a9d22d",
      "requirementType": "profile_compliance",
      "profileRef": {
        "kind": "VERSIONED",
        "objectType": "zhiju.quality.quality_profile",
        "objectId": "018f22e2-7c15-7b52-8d86-2de956a9d20b",
        "versionId": "018f22e2-7c15-7b52-8d86-2de956a9d20b",
        "scope": {
          "enterpriseId": "018f22e2-7c15-7b2e-8d86-2de956a9d201",
          "projectId": "018f22e2-7c15-7b2e-8d86-2de956a9d202"
        }
      },
      "satisfied": true
    }
  ],
  "requiredReleaseGateSpecs": [
    {
      "objectType": "zhiju.quality.gate_spec",
      "gateSpecId": "018f22e2-7c15-7c02-8d86-2de956a9d216",
      "gateVersion": "1",
      "qualityProfileVersionId": "018f22e2-7c15-7c22-8d86-2de956a9d218",
      "evaluationStage": "RELEASE_READINESS"
    }
  ],
  "releaseGateResultRefs": [
    {
      "objectType": "zhiju.quality.gate_result",
      "gateSpecId": "018f22e2-7c15-7c02-8d86-2de956a9d216",
      "gateResultId": "018f22e2-7c15-7c12-8d86-2de956a9d217",
      "qualityProfileVersionId": "018f22e2-7c15-7c22-8d86-2de956a9d218",
      "evaluationStage": "RELEASE_READINESS",
      "revisionContentHash": {
        "algorithm": "SHA-256",
        "digest": "0000000000000000000000000000000000000000000000000000000000000000",
        "canonicalizationVersion": "1"
      }
    }
  ],
  "readiness": {
    "status": "READY_FOR_AUTHORIZATION",
    "reasons": []
  },
  "evaluatedAt": "2026-08-17T00:00:00Z"
}
